[
  {"schema_version":"1.0.0","assertion_id":"codexify:assertion:product-architecture:beta-dcw-v1","assertion_kind":"posture","subject_id":"codexify:program:digital-cognitive-workspace","assertion_scope":"Intentionally shipped and supportable local-first Beta workspace envelope; bounded surfaces retain their own limits.","effective_from":"2026-08-14T00:00:00Z","authority_document_ids":["codexify:doc:architecture:current-state","codexify:doc:adr:069-codexify-beta-runtime-support-boundary"],"evidence_document_ids":["codexify:doc:architecture:system-overview","codexify:doc:architecture:flows"],"governing_adr_document_ids":["codexify:doc:adr:069-codexify-beta-runtime-support-boundary","codexify:doc:adr:057-product-architecture-ontology-dlg-integration"],"repository_revision":"f4fece599e9e081154a7a7a96e1923f7f5c205b5","evidence_class":"documented-contract","notes":"Beta Supported posture under ADR-069; not every workspace-adjacent feature is supported.","record_purpose":"canonical_assertion","posture":{"support_posture":"supported","runtime_participation":"required","ownership_state":"owned","strategy_state":"now","integration_state":"integrated"}},
  {"schema_version":"1.0.0","assertion_id":"codexify:assertion:product-architecture:beta-node-runtime-v1","assertion_kind":"posture","subject_id":"codexify:program:node-runtime","assertion_scope":"Supported local Docker Compose node runtime and lifecycle under the default local-only profile.","effective_from":"2026-08-14T00:00:00Z","authority_document_ids":["codexify:doc:architecture:current-state","codexify:doc:adr:069-codexify-beta-runtime-support-boundary"],"evidence_document_ids":["codexify:doc:architecture:config-and-ops","codexify:doc:architecture:system-overview"],"governing_adr_document_ids":["codexify:doc:adr:069-codexify-beta-runtime-support-boundary","codexify:doc:adr:057-product-architecture-ontology-dlg-integration"],"repository_revision":"f4fece599e9e081154a7a7a96e1923f7f5c205b5","evidence_class":"documented-contract","notes":"Beta Supported supporting platform posture; runtime proof and release readiness remain separate evidence questions.","record_purpose":"canonical_assertion","posture":{"support_posture":"supported","runtime_participation":"supporting","ownership_state":"owned","strategy_state":"now","integration_state":"integrated"}},
  {"schema_version":"1.0.0","assertion_id":"codexify:assertion:product-architecture:beta-threadspace-v1","assertion_kind":"posture","subject_id":"codexify:program:threadspace","assertion_scope":"ThreadSpace is partial; Hosted Rooms are Qualification Pending and federation is intentionally Out of Beta.","effective_from":"2026-08-14T00:00:00Z","authority_document_ids":["codexify:doc:architecture:current-state","codexify:doc:adr:069-codexify-beta-runtime-support-boundary"],"evidence_document_ids":["codexify:doc:architecture:hosted-room-sovereign-node-contract"],"governing_adr_document_ids":["codexify:doc:adr:069-codexify-beta-runtime-support-boundary","codexify:doc:adr:057-product-architecture-ontology-dlg-integration"],"repository_revision":"f4fece599e9e081154a7a7a96e1923f7f5c205b5","evidence_class":"documented-contract","notes":"The program as a whole is not Beta Supported; this does not promote Hosted Rooms or federation.","record_purpose":"canonical_assertion","posture":{"support_posture":"internal","runtime_participation":"optional","ownership_state":"owned","strategy_state":"next","integration_state":"partial"}},
  {"schema_version":"1.0.0","assertion_id":"codexify:assertion:product-architecture:beta-identity-v1","assertion_kind":"posture","subject_id":"codexify:capability:identity","assertion_scope":"Codexify-native identity and account ownership boundaries used by supported local workspace surfaces.","effective_from":"2026-08-14T00:00:00Z","authority_document_ids":["codexify:doc:architecture:current-state","codexify:doc:adr:069-codexify-beta-runtime-support-boundary"],"evidence_document_ids":["codexify:doc:architecture:system-overview"],"governing_adr_document_ids":["codexify:doc:adr:069-codexify-beta-runtime-support-boundary","codexify:doc:adr:057-product-architecture-ontology-dlg-integration"],"repository_revision":"f4fece599e9e081154a7a7a96e1923f7f5c205b5","evidence_class":"documented-contract","notes":"Supported within the local account-scoped boundary; remote or multi-user authority is not inferred.","record_purpose":"canonical_assertion","posture":{"support_posture":"supported","runtime_participation":"supporting","ownership_state":"owned","strategy_state":"now","integration_state":"integrated"}},
  {"schema_version":"1.0.0","assertion_id":"codexify:assertion:product-architecture:beta-authorization-policy-v1","assertion_kind":"posture","subject_id":"codexify:capability:authorization-policy","assertion_scope":"Guardian-owned authorization and bounded capability policy for supported local surfaces.","effective_from":"2026-08-14T00:00:00Z","authority_document_ids":["codexify:doc:architecture:current-state","codexify:doc:adr:069-codexify-beta-runtime-support-boundary"],"evidence_document_ids":["codexify:doc:architecture:agent-tool-loop-contract"],"governing_adr_document_ids":["codexify:doc:adr:069-codexify-beta-runtime-support-boundary","codexify:doc:adr:057-product-architecture-ontology-dlg-integration"],"repository_revision":"f4fece599e9e081154a7a7a96e1923f7f5c205b5","evidence_class":"documented-contract","notes":"Supported policy capability does not authorize arbitrary tools, shell, filesystem mutation, or public Command Bus access.","record_purpose":"canonical_assertion","posture":{"support_posture":"supported","runtime_participation":"supporting","ownership_state":"owned","strategy_state":"now","integration_state":"integrated"}},
  {"schema_version":"1.0.0","assertion_id":"codexify:assertion:product-architecture:beta-context-retrieval-v1","assertion_kind":"posture","subject_id":"codexify:capability:context-retrieval-assembly","assertion_scope":"Private, workspace-scoped, and local-workspace retrieval used by supported chat behavior.","effective_from":"2026-08-14T00:00:00Z","authority_document_ids":["codexify:doc:architecture:current-state","codexify:doc:adr:069-codexify-beta-runtime-support-boundary"],"evidence_document_ids":["codexify:doc:architecture:flows"],"governing_adr_document_ids":["codexify:doc:adr:069-codexify-beta-runtime-support-boundary","codexify:doc:adr:057-product-architecture-ontology-dlg-integration"],"repository_revision":"f4fece599e9e081154a7a7a96e1923f7f5c205b5","evidence_class":"documented-contract","notes":"Supported retrieval is bounded to implemented local and workspace scopes; arbitrary or federation-derived retrieval is not promoted.","record_purpose":"canonical_assertion","posture":{"support_posture":"supported","runtime_participation":"supporting","ownership_state":"owned","strategy_state":"now","integration_state":"integrated"}},
  {"schema_version":"1.0.0","assertion_id":"codexify:assertion:product-architecture:beta-continuity-v1","assertion_kind":"posture","subject_id":"codexify:capability:continuity","assertion_scope":"Bounded import, migration, owner-scoped retry/recovery, and supported account continuity entry surfaces.","effective_from":"2026-08-14T00:00:00Z","effective_until":"2026-08-20T00:03:57Z","authority_document_ids":["codexify:doc:architecture:current-state","codexify:doc:adr:069-codexify-beta-runtime-support-boundary"],"evidence_document_ids":["codexify:doc:architecture:account-export-restore-contract"],"governing_adr_document_ids":["codexify:doc:adr:069-codexify-beta-runtime-support-boundary","codexify:doc:adr:057-product-architecture-ontology-dlg-integration"],"repository_revision":"f4fece599e9e081154a7a7a96e1923f7f5c205b5","evidence_class":"documented-contract","notes":"Supported bounded continuity does not imply every external export format or future Continuity Protocol capability. Historical record closed 2026-08-19 by beta-continuity-v2, which adds the proven Anthropic / Claude account-export conversation-import boundary.","record_purpose":"canonical_assertion","posture":{"support_posture":"supported","runtime_participation":"supporting","ownership_state":"owned","strategy_state":"now","integration_state":"partial"}},